{
  "circuit": {
    "benchmark_family": "qaoa",
    "canonical_circuit_id": "qaoa_indep_qiskit_10",
    "circuit_id": "qaoa_indep_qiskit_10",
    "declared_num_qubits": 10,
    "depth": 11,
    "device_compatibility": {
      "compatible": true,
      "device_num_qubits": 27,
      "reason": null
    },
    "duplicate_group_size": 1,
    "features": {
      "dimension": 49,
      "extractor": "mqt.predictor.ml.helper.create_feature_vector",
      "values": {
        "critical_depth": 0.35,
        "depth": 11.0,
        "entanglement_ratio": 0.4,
        "gate_count_c3sqrtx": 0.0,
        "gate_count_c3x": 0.0,
        "gate_count_c4x": 0.0,
        "gate_count_ccx": 0.0,
        "gate_count_ch": 0.0,
        "gate_count_cp": 0.0,
        "gate_count_crx": 0.0,
        "gate_count_cry": 0.0,
        "gate_count_crz": 0.0,
        "gate_count_cswap": 0.0,
        "gate_count_csx": 0.0,
        "gate_count_cu": 0.0,
        "gate_count_cu1": 0.0,
        "gate_count_cu3": 0.0,
        "gate_count_cx": 0.0,
        "gate_count_cy": 0.0,
        "gate_count_cz": 0.0,
        "gate_count_h": 10.0,
        "gate_count_id": 0.0,
        "gate_count_p": 0.0,
        "gate_count_rc3x": 0.0,
        "gate_count_rccx": 0.0,
        "gate_count_rx": 20.0,
        "gate_count_rxx": 0.0,
        "gate_count_ry": 0.0,
        "gate_count_rz": 0.0,
        "gate_count_rzz": 20.0,
        "gate_count_s": 0.0,
        "gate_count_sdg": 0.0,
        "gate_count_swap": 0.0,
        "gate_count_sx": 0.0,
        "gate_count_sxdg": 0.0,
        "gate_count_t": 0.0,
        "gate_count_tdg": 0.0,
        "gate_count_u": 0.0,
        "gate_count_u0": 0.0,
        "gate_count_u1": 0.0,
        "gate_count_u2": 0.0,
        "gate_count_u3": 0.0,
        "gate_count_x": 0.0,
        "gate_count_y": 0.0,
        "gate_count_z": 0.0,
        "liveness": 0.7272727272727273,
        "num_qubits": 10.0,
        "parallelism": 0.393939393939394,
        "program_communication": 0.2222222222222222
      }
    },
    "file_name": "qaoa_indep_qiskit_10.qasm",
    "generator": "qiskit",
    "is_duplicate_alias": false,
    "is_exact_duplicate": false,
    "leakage_group": "qaoa",
    "num_clbits": 10,
    "num_qubits": 10,
    "operation_counts": {
      "barrier": 1,
      "h": 10,
      "measure": 10,
      "rx": 20,
      "rzz": 20
    },
    "size": 60,
    "source_ref": "circuits/train/qaoa_indep_qiskit_10.qasm",
    "source_sha256": "78937efadee977d915df27843787e46517b6d5d7711b20514d5e854611fcc6c9",
    "split": "train"
  },
  "compiled_circuit": {
    "artifact_ref": "artifacts/qiskit_dataset_cache/expected_fidelity/compiled_qasm/run_c964a105615398c50cc11689543cc8afd07082ce9bddc0b50824454dcf28b2a7.qasm",
    "depth": 53,
    "format": "OpenQASM 2",
    "num_qubits": 27,
    "operation_counts": {
      "barrier": 1,
      "cx": 61,
      "measure": 10,
      "rz": 97,
      "sx": 50
    },
    "qasm_sha256": "3bed09b91c03f037d65f78a9384ac4e09ae5fbd1ab873382810a785720aa99f0",
    "size": 218,
    "two_qubit_gate_count": 61
  },
  "configuration": {
    "catalog_id": "qiskit_expected_fidelity_pilot_v1",
    "config_id": "o2_default_default",
    "layout_method": null,
    "optimization_level": 2,
    "routing_method": null,
    "study": "baseline"
  },
  "dataset_scope": "full",
  "device": {
    "coupling_edge_count": 56,
    "description": "ibm_falcon_27",
    "device_id": "ibm_falcon_27",
    "num_qubits": 27,
    "operation_names": [
      "cx",
      "delay",
      "id",
      "measure",
      "reset",
      "rz",
      "sx",
      "x"
    ],
    "provenance": {
      "calibration_kind": "synthetic_deterministic_target",
      "live_hardware_data": false,
      "provider": "mqt.bench.targets.get_device"
    },
    "target_sha256": "f30536987677ef5017fe3a89b8b4ee0a3e7252a1a226cc3db95fd9b2e822d991",
    "target_type": "qiskit.transpiler.target.Target"
  },
  "failure": null,
  "objective": {
    "direction": "maximize",
    "implementation": "mqt.predictor.reward.expected_fidelity",
    "interpretation": "Stima deterministica basata sul Qiskit Target sintetico di MQT Bench; non è una misura su hardware reale.",
    "name": "expected_fidelity"
  },
  "phase": "completed",
  "provenance": {
    "compiler": "qiskit.transpile",
    "fixed_transpile_options": {
      "approximation_degree": 1.0,
      "num_processes": 1
    },
    "generator": "qiskit_dataset.generation",
    "versions": {
      "mqt.bench": "2.0.0",
      "mqt.predictor": "2.3.0",
      "qiskit": "2.1.1"
    }
  },
  "run_id": "run_c964a105615398c50cc11689543cc8afd07082ce9bddc0b50824454dcf28b2a7",
  "schema_version": "1.0.0",
  "score": 0.8767010508,
  "seed_transpiler": 1,
  "split": "train",
  "status": "success",
  "target_validation": {
    "basis_valid": true,
    "connectivity_valid": true,
    "is_executable_on_target": true,
    "unsupported_operations": [],
    "validation_errors": []
  },
  "timings_seconds": {
    "scoring": 0.0007167159992604866,
    "serialization": 0.004276507000213314,
    "source_loading": 0.0015053030001581647,
    "target_loading": 3.099999958067201e-06,
    "target_validation": 0.0009032699999806937,
    "total": 0.0665693499995541,
    "transpilation": 0.05903432199920644
  }
}
