{
  "circuit": {
    "benchmark_family": "ae",
    "canonical_circuit_id": "ae_indep_qiskit_5",
    "circuit_id": "ae_indep_qiskit_5",
    "declared_num_qubits": 5,
    "depth": 24,
    "device_compatibility": {
      "compatible": true,
      "device_num_qubits": 133,
      "reason": null
    },
    "duplicate_group_size": 1,
    "features": {
      "dimension": 49,
      "extractor": "mqt.predictor.ml.helper.create_feature_vector",
      "values": {
        "critical_depth": 0.9285714285714286,
        "depth": 24.0,
        "entanglement_ratio": 0.45161290322580644,
        "gate_count_c3sqrtx": 0.0,
        "gate_count_c3x": 0.0,
        "gate_count_c4x": 0.0,
        "gate_count_ccx": 0.0,
        "gate_count_ch": 0.0,
        "gate_count_cp": 6.0,
        "gate_count_crx": 0.0,
        "gate_count_cry": 0.0,
        "gate_count_crz": 0.0,
        "gate_count_cswap": 0.0,
        "gate_count_csx": 0.0,
        "gate_count_cu": 0.0,
        "gate_count_cu1": 0.0,
        "gate_count_cu3": 0.0,
        "gate_count_cx": 8.0,
        "gate_count_cy": 0.0,
        "gate_count_cz": 0.0,
        "gate_count_h": 4.0,
        "gate_count_id": 0.0,
        "gate_count_p": 0.0,
        "gate_count_rc3x": 0.0,
        "gate_count_rccx": 0.0,
        "gate_count_rx": 0.0,
        "gate_count_rxx": 0.0,
        "gate_count_ry": 0.0,
        "gate_count_rz": 0.0,
        "gate_count_rzz": 0.0,
        "gate_count_s": 0.0,
        "gate_count_sdg": 0.0,
        "gate_count_swap": 0.0,
        "gate_count_sx": 0.0,
        "gate_count_sxdg": 0.0,
        "gate_count_t": 0.0,
        "gate_count_tdg": 0.0,
        "gate_count_u": 5.0,
        "gate_count_u0": 0.0,
        "gate_count_u1": 0.0,
        "gate_count_u2": 4.0,
        "gate_count_u3": 4.0,
        "gate_count_x": 0.0,
        "gate_count_y": 0.0,
        "gate_count_z": 0.0,
        "liveness": 0.4166666666666667,
        "num_qubits": 5.0,
        "parallelism": 0.07291666666666669,
        "program_communication": 1.0
      }
    },
    "file_name": "ae_indep_qiskit_5.qasm",
    "generator": "qiskit",
    "is_duplicate_alias": false,
    "is_exact_duplicate": false,
    "leakage_group": "ae",
    "num_clbits": 5,
    "num_qubits": 5,
    "operation_counts": {
      "barrier": 1,
      "cp": 6,
      "cx": 8,
      "h": 4,
      "measure": 5,
      "u": 5,
      "u2": 4,
      "u3": 4
    },
    "size": 36,
    "source_ref": "circuits/train/ae_indep_qiskit_5.qasm",
    "source_sha256": "8e4821df72704634cb81ea4d738477a8d596a49cba641e6198fdc9970e1d5d2f",
    "split": "train"
  },
  "compiled_circuit": {
    "artifact_ref": "artifacts/qiskit_dataset_cache/expected_fidelity/compiled_qasm/run_4099dd5787bf921c65f56fe22939e527311998307e5f4d4b544f4742d0b71b19.qasm",
    "depth": 106,
    "format": "OpenQASM 2",
    "num_qubits": 133,
    "operation_counts": {
      "barrier": 1,
      "cz": 30,
      "measure": 5,
      "rz": 53,
      "sx": 63,
      "x": 8
    },
    "qasm_sha256": "c6fc20cf4f7abfe8de80d87c55088b5b815c132df8109034741ade6e112afeee",
    "size": 159,
    "two_qubit_gate_count": 30
  },
  "configuration": {
    "catalog_id": "qiskit_expected_fidelity_pilot_v1",
    "config_id": "o3_default_default",
    "layout_method": null,
    "optimization_level": 3,
    "routing_method": null,
    "study": "baseline"
  },
  "dataset_scope": "full",
  "device": {
    "coupling_edge_count": 300,
    "description": "ibm_heron_133",
    "device_id": "ibm_heron_133",
    "num_qubits": 133,
    "operation_names": [
      "cz",
      "delay",
      "id",
      "measure",
      "reset",
      "rz",
      "sx",
      "x"
    ],
    "provenance": {
      "calibration_kind": "synthetic_deterministic_target",
      "live_hardware_data": false,
      "provider": "mqt.bench.targets.get_device"
    },
    "target_sha256": "804f28754ad200e42a328ba910639c9d6fd3233dff35035e7f3cb85a2fc5168a",
    "target_type": "qiskit.transpiler.target.Target"
  },
  "failure": null,
  "objective": {
    "direction": "maximize",
    "implementation": "mqt.predictor.reward.expected_fidelity",
    "interpretation": "Stima deterministica basata sul Qiskit Target sintetico di MQT Bench; non è una misura su hardware reale.",
    "name": "expected_fidelity"
  },
  "phase": "completed",
  "provenance": {
    "compiler": "qiskit.transpile",
    "fixed_transpile_options": {
      "approximation_degree": 1.0,
      "num_processes": 1
    },
    "generator": "qiskit_dataset.generation",
    "versions": {
      "mqt.bench": "2.0.0",
      "mqt.predictor": "2.3.0",
      "qiskit": "2.1.1"
    }
  },
  "run_id": "run_4099dd5787bf921c65f56fe22939e527311998307e5f4d4b544f4742d0b71b19",
  "schema_version": "1.0.0",
  "score": 0.9323996913,
  "seed_transpiler": 2,
  "split": "train",
  "status": "success",
  "target_validation": {
    "basis_valid": true,
    "connectivity_valid": true,
    "is_executable_on_target": true,
    "unsupported_operations": [],
    "validation_errors": []
  },
  "timings_seconds": {
    "scoring": 0.0005316819999734435,
    "serialization": 0.0034718620001967793,
    "source_loading": 0.0006746960000327817,
    "target_loading": 2.029999905062141e-06,
    "target_validation": 0.0015124550000109593,
    "total": 0.14121047399999043,
    "transpilation": 0.13497031899987633
  }
}
