{
  "circuit": {
    "benchmark_family": "dj",
    "canonical_circuit_id": "dj_indep_qiskit_14",
    "circuit_id": "dj_indep_qiskit_14",
    "declared_num_qubits": 14,
    "depth": 16,
    "device_compatibility": {
      "compatible": true,
      "device_num_qubits": 156,
      "reason": null
    },
    "duplicate_group_size": 1,
    "features": {
      "dimension": 49,
      "extractor": "mqt.predictor.ml.helper.create_feature_vector",
      "values": {
        "critical_depth": 1.0,
        "depth": 16.0,
        "entanglement_ratio": 0.325,
        "gate_count_c3sqrtx": 0.0,
        "gate_count_c3x": 0.0,
        "gate_count_c4x": 0.0,
        "gate_count_ccx": 0.0,
        "gate_count_ch": 0.0,
        "gate_count_cp": 0.0,
        "gate_count_crx": 0.0,
        "gate_count_cry": 0.0,
        "gate_count_crz": 0.0,
        "gate_count_cswap": 0.0,
        "gate_count_csx": 0.0,
        "gate_count_cu": 0.0,
        "gate_count_cu1": 0.0,
        "gate_count_cu3": 0.0,
        "gate_count_cx": 13.0,
        "gate_count_cy": 0.0,
        "gate_count_cz": 0.0,
        "gate_count_h": 8.0,
        "gate_count_id": 0.0,
        "gate_count_p": 0.0,
        "gate_count_rc3x": 0.0,
        "gate_count_rccx": 0.0,
        "gate_count_rx": 0.0,
        "gate_count_rxx": 0.0,
        "gate_count_ry": 0.0,
        "gate_count_rz": 0.0,
        "gate_count_rzz": 0.0,
        "gate_count_s": 0.0,
        "gate_count_sdg": 0.0,
        "gate_count_swap": 0.0,
        "gate_count_sx": 0.0,
        "gate_count_sxdg": 0.0,
        "gate_count_t": 0.0,
        "gate_count_tdg": 0.0,
        "gate_count_u": 0.0,
        "gate_count_u0": 0.0,
        "gate_count_u1": 0.0,
        "gate_count_u2": 19.0,
        "gate_count_u3": 0.0,
        "gate_count_x": 0.0,
        "gate_count_y": 0.0,
        "gate_count_z": 0.0,
        "liveness": 0.29464285714285715,
        "num_qubits": 14.0,
        "parallelism": 0.11538461538461539,
        "program_communication": 0.14285714285714285
      }
    },
    "file_name": "dj_indep_qiskit_14.qasm",
    "generator": "qiskit",
    "is_duplicate_alias": false,
    "is_exact_duplicate": false,
    "leakage_group": "dj",
    "num_clbits": 13,
    "num_qubits": 14,
    "operation_counts": {
      "barrier": 1,
      "cx": 13,
      "h": 8,
      "measure": 13,
      "u2": 19
    },
    "size": 53,
    "source_ref": "circuits/train/dj_indep_qiskit_14.qasm",
    "source_sha256": "55b41a49485f52ce6c92b9f51384f5e3a046111c24ef387cf4e471e445589ac2",
    "split": "train"
  },
  "compiled_circuit": {
    "artifact_ref": "artifacts/qiskit_dataset_cache/expected_fidelity/compiled_qasm/run_6ffc3804c2ad1f59e2464941da12f1264b56066e76d0b5891568333ac9c804de.qasm",
    "depth": 132,
    "format": "OpenQASM 2",
    "num_qubits": 156,
    "operation_counts": {
      "barrier": 1,
      "cz": 76,
      "measure": 13,
      "rz": 99,
      "sx": 147,
      "x": 9
    },
    "qasm_sha256": "aa20ee341e89b61991ac0d5dda3ecf867dc486aedf2b906df0591b650caeefe5",
    "size": 344,
    "two_qubit_gate_count": 76
  },
  "configuration": {
    "catalog_id": "qiskit_expected_fidelity_pilot_v1",
    "config_id": "o3_dense_sabre",
    "layout_method": "dense",
    "optimization_level": 3,
    "routing_method": "sabre",
    "study": "layout"
  },
  "dataset_scope": "full",
  "device": {
    "coupling_edge_count": 352,
    "description": "ibm_heron_156",
    "device_id": "ibm_heron_156",
    "num_qubits": 156,
    "operation_names": [
      "box",
      "break",
      "continue",
      "cz",
      "delay",
      "for_loop",
      "id",
      "if_else",
      "measure",
      "reset",
      "rz",
      "switch_case",
      "sx",
      "while_loop",
      "x"
    ],
    "provenance": {
      "calibration_kind": "synthetic_deterministic_target",
      "live_hardware_data": false,
      "provider": "mqt.bench.targets.get_device"
    },
    "target_sha256": "ac22db70ae7b93701b281ac711d20cfdc2ca5744b5d22c52f9cc27a9a7998f3b",
    "target_type": "qiskit.transpiler.target.Target"
  },
  "failure": null,
  "objective": {
    "direction": "maximize",
    "implementation": "mqt.predictor.reward.expected_fidelity",
    "interpretation": "Stima deterministica basata sul Qiskit Target sintetico di MQT Bench; non è una misura su hardware reale.",
    "name": "expected_fidelity"
  },
  "phase": "completed",
  "provenance": {
    "compiler": "qiskit.transpile",
    "fixed_transpile_options": {
      "approximation_degree": 1.0,
      "num_processes": 1
    },
    "generator": "qiskit_dataset.generation",
    "versions": {
      "mqt.bench": "2.2.3",
      "mqt.predictor": "2.4.0",
      "qiskit": "2.5.0"
    }
  },
  "run_id": "run_6ffc3804c2ad1f59e2464941da12f1264b56066e76d0b5891568333ac9c804de",
  "schema_version": "1.0.0",
  "score": 0.8658753772,
  "seed_transpiler": 0,
  "split": "train",
  "status": "success",
  "target_validation": {
    "basis_valid": true,
    "connectivity_valid": true,
    "is_executable_on_target": true,
    "unsupported_operations": [],
    "validation_errors": []
  },
  "timings_seconds": {
    "scoring": 0.0008996130054583773,
    "serialization": 0.004152629000600427,
    "source_loading": 0.0007438160027959384,
    "target_loading": 2.8799986466765404e-06,
    "target_validation": 0.003355920001922641,
    "total": 0.06258394600445172,
    "transpilation": 0.05336259300383972
  }
}
