{
  "circuit": {
    "benchmark_family": "pricingcall",
    "canonical_circuit_id": "pricingcall_indep_qiskit_5",
    "circuit_id": "pricingcall_indep_qiskit_5",
    "declared_num_qubits": 5,
    "depth": 36,
    "duplicate_group_size": 1,
    "features": {
      "dimension": 49,
      "extractor": "mqt.predictor.ml.helper.create_feature_vector",
      "values": {
        "critical_depth": 1.0,
        "depth": 36.0,
        "entanglement_ratio": 0.3333333333333333,
        "gate_count_c3sqrtx": 0.0,
        "gate_count_c3x": 0.0,
        "gate_count_c4x": 0.0,
        "gate_count_ccx": 6.0,
        "gate_count_ch": 0.0,
        "gate_count_cp": 0.0,
        "gate_count_crx": 0.0,
        "gate_count_cry": 2.0,
        "gate_count_crz": 0.0,
        "gate_count_cswap": 0.0,
        "gate_count_csx": 0.0,
        "gate_count_cu": 0.0,
        "gate_count_cu1": 0.0,
        "gate_count_cu3": 0.0,
        "gate_count_cx": 12.0,
        "gate_count_cy": 0.0,
        "gate_count_cz": 0.0,
        "gate_count_h": 0.0,
        "gate_count_id": 0.0,
        "gate_count_p": 0.0,
        "gate_count_rc3x": 0.0,
        "gate_count_rccx": 0.0,
        "gate_count_rx": 0.0,
        "gate_count_rxx": 0.0,
        "gate_count_ry": 4.0,
        "gate_count_rz": 0.0,
        "gate_count_rzz": 0.0,
        "gate_count_s": 0.0,
        "gate_count_sdg": 0.0,
        "gate_count_swap": 0.0,
        "gate_count_sx": 0.0,
        "gate_count_sxdg": 0.0,
        "gate_count_t": 0.0,
        "gate_count_tdg": 0.0,
        "gate_count_u": 9.0,
        "gate_count_u0": 0.0,
        "gate_count_u1": 0.0,
        "gate_count_u2": 0.0,
        "gate_count_u3": 1.0,
        "gate_count_x": 8.0,
        "gate_count_y": 0.0,
        "gate_count_z": 0.0,
        "liveness": 0.40555555555555556,
        "num_qubits": 5.0,
        "parallelism": 0.041666666666666685,
        "program_communication": 0.4
      }
    },
    "file_name": "pricingcall_indep_qiskit_5.qasm",
    "generator": "qiskit",
    "is_duplicate_alias": false,
    "is_exact_duplicate": false,
    "leakage_group": "pricing",
    "num_clbits": 5,
    "num_qubits": 5,
    "operation_counts": {
      "barrier": 1,
      "ccx": 6,
      "cry": 2,
      "cx": 12,
      "measure": 5,
      "ry": 4,
      "u": 9,
      "u3": 1,
      "x": 8
    },
    "size": 47,
    "source_ref": "circuits/validation/pricingcall_indep_qiskit_5.qasm",
    "source_sha256": "3bfbab0c9e8d1f3d439975f907ccb451367de4b6de5018a9fb71f4ddd6dc3905",
    "split": "validation"
  },
  "compiled_circuit": {
    "artifact_ref": "artifacts/qiskit_dataset_cache/expected_fidelity/compiled_qasm/run_553ad2449815bf815e841fb7ae653f4afbefd1fb947b74ba49654de9f192bf31.qasm",
    "depth": 143,
    "format": "OpenQASM 2",
    "num_qubits": 127,
    "operation_counts": {
      "barrier": 1,
      "cx": 70,
      "measure": 5,
      "rz": 90,
      "sx": 47,
      "x": 8
    },
    "qasm_sha256": "1b913533e93f2f7efb16d1be024f70fd7e2d5bd46f86f956a9dce876273d4c99",
    "size": 220,
    "two_qubit_gate_count": 70
  },
  "configuration": {
    "catalog_id": "qiskit_expected_fidelity_pilot_v1",
    "config_id": "o2_sabre_sabre",
    "layout_method": "sabre",
    "optimization_level": 2,
    "routing_method": "sabre",
    "study": "layout"
  },
  "dataset_scope": "pilot",
  "device": {
    "coupling_edge_count": 284,
    "description": "ibm_falcon_127",
    "device_id": "ibm_falcon_127",
    "num_qubits": 127,
    "operation_names": [
      "cx",
      "delay",
      "id",
      "measure",
      "reset",
      "rz",
      "sx",
      "x"
    ],
    "provenance": {
      "calibration_kind": "synthetic_deterministic_target",
      "live_hardware_data": false,
      "provider": "mqt.bench.targets.get_device"
    },
    "target_sha256": "225e5f6fd85af0b37a1dd7c6306dd046a8c7ca585f135dda6e6418dd16f76b48",
    "target_type": "qiskit.transpiler.target.Target"
  },
  "failure": null,
  "objective": {
    "direction": "maximize",
    "implementation": "mqt.predictor.reward.expected_fidelity",
    "interpretation": "Stima deterministica basata sul Qiskit Target sintetico di MQT Bench; non e una misura su hardware reale.",
    "name": "expected_fidelity"
  },
  "phase": "completed",
  "provenance": {
    "compiler": "qiskit.transpile",
    "fixed_transpile_options": {
      "approximation_degree": 1.0,
      "num_processes": 1
    },
    "generator": "qiskit_dataset.generation",
    "versions": {
      "mqt.bench": "2.0.0",
      "mqt.predictor": "2.3.0",
      "qiskit": "2.1.1"
    }
  },
  "run_id": "run_553ad2449815bf815e841fb7ae653f4afbefd1fb947b74ba49654de9f192bf31",
  "schema_version": "1.0.0",
  "score": 0.8428386764,
  "seed_transpiler": 2,
  "split": "validation",
  "status": "success",
  "target_validation": {
    "basis_valid": true,
    "connectivity_valid": true,
    "is_executable_on_target": true,
    "unsupported_operations": [],
    "validation_errors": []
  },
  "timings_seconds": {
    "scoring": 0.00037683899790863506,
    "serialization": 0.001799155001208419,
    "source_loading": 0.00046067199946264736,
    "target_loading": 1.5000005078036338e-06,
    "target_validation": 0.0007691680002608337,
    "total": 0.023957438999786973,
    "transpilation": 0.02051165499869967
  }
}
